{
  "version": 1,
  "plan_id": "orchestration-replay-v1",
  "objective": "Replay a bounded collaboration workflow with independent review work scheduled beside implementation.",
  "evidence_class": "offline_schedule_estimate",
  "decision_provider": "rules",
  "source": {
    "generated_by": "supervisor",
    "revision": "revision:multi-agent-collaboration@788c007ae1150b1d379766367c810665698c487d"
  },
  "api_policy": {
    "third_party_api": false,
    "model_call_owners": ["claude_code_cli", "codex_cli"]
  },
  "nodes": [
    {
      "id": "intake",
      "title": "Freeze task inputs and acceptance evidence",
      "executor": "claude",
      "transport": "claude_code_cli",
      "session_policy": "reuse_existing",
      "depends_on": [],
      "context": "Read the user-approved objective and the current repository evidence.",
      "source": ["/tmp/multi-agent-collaboration-upgrade/README.md"],
      "scope": "Write only the intake evidence for this replay.",
      "forbidden": "Do not alter the upstream repository or launch a replacement session.",
      "verify": "Record the source revision and acceptance checksums.",
      "write_scope": "replay/intake",
      "expected_seconds": 90,
      "retry_seconds": 30,
      "observed_retries": 0
    },
    {
      "id": "protocol-inspection",
      "title": "Inspect task, ACK and callback boundaries",
      "executor": "codex",
      "transport": "codex_cli",
      "session_policy": "reuse_existing",
      "depends_on": ["intake"],
      "context": "Inspect the existing delivery contract and identify the dispatch boundary.",
      "source": ["/tmp/multi-agent-collaboration-upgrade/SKILL.md"],
      "scope": "Write a read-only inspection report.",
      "forbidden": "Do not send cmux input or modify hook configuration.",
      "verify": "Every claim links to a source path and line range.",
      "write_scope": "replay/protocol-report",
      "expected_seconds": 120,
      "retry_seconds": 30,
      "observed_retries": 0
    },
    {
      "id": "policy-review",
      "title": "Review API and session-reuse constraints",
      "executor": "claude",
      "transport": "claude_code_cli",
      "session_policy": "reuse_existing",
      "depends_on": ["intake"],
      "context": "Check that every model call remains owned by an existing Claude/Codex CLI session.",
      "source": ["/tmp/multi-agent-collaboration-upgrade/policies/multi-agent-policy.json"],
      "scope": "Write a policy review with blocking findings only.",
      "forbidden": "Do not add SDKs, API keys, proxies, or third-party model calls.",
      "verify": "The review contains explicit PASS/FAIL evidence for each policy.",
      "write_scope": "replay/policy-report",
      "expected_seconds": 100,
      "retry_seconds": 30,
      "observed_retries": 0
    },
    {
      "id": "implementation",
      "title": "Implement the isolated orchestration adapter",
      "executor": "claude",
      "transport": "claude_code_cli",
      "session_policy": "reuse_existing",
      "depends_on": ["protocol-inspection", "policy-review"],
      "context": "Implement only the upgrade repository's adapter and tests.",
      "source": ["/tmp/multi-agent-collaboration-upgrade/SKILL.md"],
      "scope": "Write code and tests under the upgrade repository.",
      "forbidden": "Do not modify the upstream checkout or deploy anything.",
      "verify": "Run the focused planner tests and report exact counts.",
      "write_scope": "upgrade/source",
      "expected_seconds": 180,
      "retry_seconds": 45,
      "observed_retries": 0
    },
    {
      "id": "documentation",
      "title": "Document the integration and evidence limits",
      "executor": "codex",
      "transport": "codex_cli",
      "session_policy": "reuse_existing",
      "depends_on": ["protocol-inspection", "policy-review"],
      "context": "Document how the adapter relates to OmO, codeg and TypeSafe/JEV.",
      "source": ["https://github.com/code-yeongyu/oh-my-openagent", "https://github.com/spacering-net/codeg"],
      "scope": "Write only upgrade repository documentation.",
      "forbidden": "Do not claim a live JEV or third-party API integration.",
      "verify": "Every external claim includes a pinned SHA or URL.",
      "write_scope": "upgrade/docs",
      "expected_seconds": 90,
      "retry_seconds": 30,
      "observed_retries": 0
    },
    {
      "id": "tests",
      "title": "Run offline contract and schedule tests",
      "executor": "codex",
      "transport": "codex_cli",
      "session_policy": "reuse_existing",
      "depends_on": ["implementation", "documentation"],
      "context": "Run the repository's offline tests and inspect generated artifacts.",
      "source": ["/tmp/multi-agent-collaboration-upgrade/scripts/test_all.py"],
      "scope": "Write test output under the replay artifact root.",
      "forbidden": "Do not run live model calls or touch the upstream repository.",
      "verify": "All tests pass and no forbidden API field is present.",
      "write_scope": "replay/test-output",
      "expected_seconds": 120,
      "retry_seconds": 30,
      "observed_retries": 0
    },
    {
      "id": "closeout-audit",
      "title": "Audit delivery evidence and closeout claims",
      "executor": "claude",
      "transport": "claude_code_cli",
      "session_policy": "reuse_existing",
      "depends_on": ["tests"],
      "context": "Review the generated plan, schedule, tests and evidence classification.",
      "source": ["/tmp/multi-agent-collaboration-upgrade/references/efficiency-and-closeout.md"],
      "scope": "Write a final audit report; do not rewrite source.",
      "forbidden": "Do not call the result a measured live gain without CLI replay evidence.",
      "verify": "The audit separates offline estimate from measured replay.",
      "write_scope": "replay/final-audit",
      "expected_seconds": 90,
      "retry_seconds": 30,
      "observed_retries": 0
    }
  ]
}
